{
  "schema_version": "v0",
  "report_id": "sm-render-benchmark-v0",
  "suite_id": "scientific-memory-rendering-v0",
  "case_id": "valid-scientific-memory-import",
  "producer_id": "scientific-memory",
  "workflow_id": "labtrust.qc_release_v0.1",
  "required_sections": [
    "provenance",
    "hashes",
    "handoffs",
    "verification",
    "formal_checks",
    "limitations",
    "lineage",
    "repair_hints"
  ],
  "sections": {
    "provenance": {
      "present": true,
      "score": 1.0
    },
    "hashes": {
      "present": true,
      "score": 1.0
    },
    "handoffs": {
      "present": true,
      "score": 1.0
    },
    "verification": {
      "present": true,
      "score": 1.0
    },
    "formal_checks": {
      "present": true,
      "score": 1.0
    },
    "limitations": {
      "present": true,
      "score": 1.0
    },
    "lineage": {
      "present": true,
      "score": 1.0
    },
    "repair_hints": {
      "present": true,
      "score": 1.0
    }
  },
  "sections_present_count": 8,
  "sections_required_count": 8,
  "quality_score": 1.0,
  "gaps": [],
  "source_repo": "https://github.com/fraware/scientific-memory",
  "source_commit": "17e414501b3e1c58e8fbde1fe89a828440a945d9",
  "signature_or_digest": "sha256:be7600a500877fb925e4033f461e49d669aad153a8a852f7f76ac7f82f37be0e"
}
